Ticket id,Interaction id,Interaction date,Mailbox,x_ts,x_ic,Innso TYPOLOGY_TICKET ,y1,y2,y3,y4
23008,64397,44805.61944,support.eu@Company.com,withdrawal,den tors kl skrev will forward the details to our internal team to see if they can find out under which account this subscription is active so that you cancel it however for our team to be able to identify the account connected to the transaction we need the invoice number id starting with if the payment was made by paypal if your payment was made by bank card we need the last digits of your bank card associated to that specific subscription transaction sincerely cristiana se is the provider of company mobile services to company and honor device owners in to den tis skrev please note that we were able to identify company id associated to this email address you are writing us from therefore please try to log in the online webportal to cancel your subscription using as your company id if you access the online portal with your phone you should first activate the desktop version of the browser to be able to see the payments purchases tab on the account and security page if after logging in there is no subscriptions shown on the payments page please provide us the following information to investigate your account and provide more information around the subscription proof of transactions if the payment was made with your bank card copy of your bank statement showing the charges from se and the last digits of your bank card if the payment was made with your paypal screenshot of payment with transaction invoice number available id starting with c if the payment was made with your phone the phone number get charged screenshot of phone bill showing the charges from se if you have any further questions please feel free to reply to this email thread and we will be happy to walk you through your doubts sincerely cristiana se is the provider of company mobile services to company and honor device owners in to so if dont have my account cant cancel it den tis skrev we do not have the necessary permission to cancel subscriptions on behalf of our users but will gladly walk you through the process on how to cancel it from any type of device or browser login to https id cloud company com cas portal login html and go to payment and purchases subscriptions password free payments and touch remove please be aware that if you access the online portal with your phone you should first activate the desktop version of the browser if the subscription disappears from your account it indicates that it has been canceled successfully once canceled no deduction will be made from your account from the following month onward we would greatly appreciate your feedback regarding our email exchange as we need your input to keep improving our service therefore we invite you to fill in the survey that will soon arrive on the email address you used to contact us if you have any further questions please feel free to reply to this email thread and we will be happy to walk you through your doubts sincerely cristiana se is the provider of company mobile services to company and honor device owners in to ok want to cancel this one because have samsung now instead den tis skrev would be more than happy to assist you with your inquiry but please take in consideration that we can offer you support in the following languages english portuguese spanish italian french german if you would like to cancel your subscription please follow the guideline below from any type of device or browser login to https id cloud company com cas portal login html and go to payment and purchases subscriptions password free payments and touch remove please be aware that if you access the online portal with your phone you should first activate the desktop version of the browser if the subscription disappears from your account it indicates that it has been canceled successfully once canceled no deduction will be made from your account from the following month onward if for any reason you need further assistance please provide us the following information to investigate your account and provide more information around the subscription your company id phone number include country code email address proof of transactions if the payment was made with your bank card copy of your bank statement showing the charges from se and the last digits of your bank card if the payment was made with your paypal screenshot of payment with transaction invoice number available id starting with c if the payment was made with your phone the phone number get charged screenshot of phone bill showing the charges from se if you have any further questions please feel free to reply to this email thread and we will be happy to walk you through your doubts we would greatly appreciate your feedback regarding our email exchange as we need your input to keep improving our service therefore we invite you to fill in the survey that will soon arrive on the email address you used to contact us sincerely cristiana se is the provider of company mobile services to company and honor device owners in to hej jag har inte kvar min telefon och vill rmed ga upp mitt abonnemang hos er mvh katarina,In-App Purchase / Cancel /terminate subscription,In-App Purchase ,Suggestion,Payment,Subscription cancellation
23008,64432,44805.66042,support.eu@Company.com,dismissal,for your kind patience as we carefully gathered more information for your inquiry hope this email finds you well our team has confirmed that they issued the refund for transaction made on for sek on the company id associated the account has gb gb and subscribed on please allow up to working days for the amount to reach back to your account after we refunded the transaction the cloud subscription will automatically cancel so you will not be further charged in accordance with the eu law and the cloud user agreement which is accepted by users before buying the subscription customers are not entitled to refund if their refund request is made after more than days for your understanding and kind cooperation for further questions please feel free to reply to this email thread and we will be happy to walk you through your doubts also we would greatly appreciate your feedback regarding our email exchange as we need your input to keep improving our service therefore we invite you to fill in the survey that will soon arrive on the email address you used to contact us sincerely cristiana se is the provider of company mobile services to company and honor device owners in to den tors kl skrev will forward the details to our internal team to see if they can find out under which account this subscription is active so that you cancel it however for our team to be able to identify the account connected to the transaction we need the invoice number id starting with if the payment was made by paypal if your payment was made by bank card we need the last digits of your bank card associated to that specific subscription transaction sincerely cristiana se is the provider of company mobile services to company and honor device owners in to den tis skrev please note that we were able to identify company id associated to this email address you are writing us from therefore please try to log in the online webportal to cancel your subscription using as your company id if you access the online portal with your phone you should first activate the desktop version of the browser to be able to see the payments purchases tab on the account and security page if after logging in there is no subscriptions shown on the payments page please provide us the following information to investigate your account and provide more information around the subscription proof of transactions if the payment was made with your bank card copy of your bank statement showing the charges from se and the last digits of your bank card if the payment was made with your paypal screenshot of payment with transaction invoice number available id starting with c if the payment was made with your phone the phone number get charged screenshot of phone bill showing the charges from se if you have any further questions please feel free to reply to this email thread and we will be happy to walk you through your doubts sincerely cristiana se is the provider of company mobile services to company and honor device owners in to so if dont have my account cant cancel it den tis skrev we do not have the necessary permission to cancel subscriptions on behalf of our users but will gladly walk you through the process on how to cancel it from any type of device or browser login to https id cloud company com cas portal login html and go to payment and purchases subscriptions password free payments and touch remove please be aware that if you access the online portal with your phone you should first activate the desktop version of the browser if the subscription disappears from your account it indicates that it has been canceled successfully once canceled no deduction will be made from your account from the following month onward we would greatly appreciate your feedback regarding our email exchange as we need your input to keep improving our service therefore we invite you to fill in the survey that will soon arrive on the email address you used to contact us if you have any further questions please feel free to reply to this email thread and we will be happy to walk you through your doubts sincerely cristiana se is the provider of company mobile services to company and honor device owners in to ok want to cancel this one because have samsung now instead den tis skrev would be more than happy to assist you with your inquiry but please take in consideration that we can offer you support in the following languages english portuguese spanish italian french german if you would like to cancel your subscription please follow the guideline below from any type of device or browser login to https id cloud company com cas portal login html and go to payment and purchases subscriptions password free payments and touch remove please be aware that if you access the online portal with your phone you should first activate the desktop version of the browser if the subscription disappears from your account it indicates that it has been canceled successfully once canceled no deduction will be made from your account from the following month onward if for any reason you need further assistance please provide us the following information to investigate your account and provide more information around the subscription your company id phone number include country code email address proof of transactions if the payment was made with your bank card copy of your bank statement showing the charges from se and the last digits of your bank card if the payment was made with your paypal screenshot of payment with transaction invoice number available id starting with c if the payment was made with your phone the phone number get charged screenshot of phone bill showing the charges from se if you have any further questions please feel free to reply to this email thread and we will be happy to walk you through your doubts we would greatly appreciate your feedback regarding our email exchange as we need your input to keep improving our service therefore we invite you to fill in the survey that will soon arrive on the email address you used to contact us sincerely cristiana se is the provider of company mobile services to company and honor device owners in to hej jag har inte kvar min telefon och vill rmed ga upp mitt abonnemang hos er mvh katarina,In-App Purchase / Cancel /terminate subscription,In-App Purchase ,Suggestion,Payment,Subscription cancellation
23001,64347,44805.57222,support.eu@Company.com,issue,want to terminate this contract immediately,In-App Purchase / Cancel /terminate subscription,In-App Purchase ,Suggestion,Payment,Subscription cancellation
23001,64351,44805.58333,support.de@Company.com,cancellation of subscription,if you are entitled to be entitled to be entitled to be entitled to be entitled to be entitled to be entitled to be entitled to be entitled to be entitled to be entitled to be entitled to be entitled to be entitled to be entitled to be entitled to be entitled to be entitled to be entitled to be entitled to be entitled to be entitled to be entitled to be entitled to be entitled to be entitled to be entitled to be entitled to be entitled to be entitled to be entitled to be entitled to be entitled to be entitled to be entitled to be entitled to be entitled to be entitled to be entitled,In-App Purchase / Cancel /terminate subscription,In-App Purchase ,Suggestion,Payment,Subscription cancellation
23000,64339,44805.56111,support.eu@Company.com,cancel next payments,m not longer in need to pay more because have an other mobile and don need more space hope that there is no problem to cancel future payment mta outlook for android,In-App Purchase / Cancel /terminate subscription,In-App Purchase ,Suggestion,Payment,Subscription cancellation
23000,64345,44805.56944,support.eu@Company.com,cancel next payments,we hope you re doing well this email is regarding your concern about cancelling your subscription without access to your company device ll be more than happy to assist you further in order to proceed further would you please send us the following details you company id phone number include country code email address proof of last associated transactions if the payment was made with your bank card copy of your bank statement showing the charges from se and the last digits of your bank card if the payment was made with your paypal a screenshot of payment with transaction invoice number available id starting with c if the payment was made with your phone the phone number get charged screenshot of phone bill showing the charges from se after that we will contact our internal team and get back to you as soon as possible also please note that if you don have company phone anymore you can manage all your subscriptions on our online portal following these steps go to https id cloud company com cas portal login html log in account center payment and purchases subscriptions password free payments and click remove if you will access our online portal through your phone browser please enable the desktop site so you will be able to see the payment and purchases window for further questions please feel free to reply to this email thread and we will be happy to walk you through your doubts sincerely cristiana se is the provider of company mobile services to company and honor device owners in to cancel next payments m not longer in need to pay more because have an other mobile and don need more space hope that there is no problem to cancel future payment eriksson mta outlook for android,In-App Purchase / Cancel /terminate subscription,In-App Purchase ,Suggestion,Payment,Subscription cancellation
22993,64313,44805.52222,support.eu@Company.com,company support issue submit,product cloud requests view change or cancel subscription contact full name dirk kuhlmann phone numbe contact email address company id account sum of the issue need bill for this subscription german business requirements there is no app namecompany cloud zahlungsmethode company abonniert abonnementnummer ed home news events products partners support copyright company se,In-App Purchase / Invoice request,In-App Purchase ,Suggestion,Invoice,Invoice related request
22993,64324,44805.5375,support.de@Company.com,required account,you can find these invoices quickly if you go to settings account center payments and purchases email click on the corresponding order and then on rechness anfordern fill out all the required fields confirm the information entered and click on in the upper right corner to submit your request you can find these invoices quickly if you go to settings account center payments and purchases email click on the corresponding order and then on rechness anfordern fill out all the required fields confirm the information entered and click on in the upper right corner to submit your request you will be able to submit invoice you will be able to submit invoice you will be able to submit invoice you will be able to submit,In-App Purchase / Invoice request,In-App Purchase ,Suggestion,Invoice,Invoice related request
22991,64306,44805.51458,support.eu@Company.com,unknown payment,could you please tell me what this payment is for,In-App Purchase / Cancel /terminate subscription,In-App Purchase ,Suggestion,Payment,Query deduction details
22991,64314,44805.52431,support.eu@Company.com,unknown payment,we hope you re doing well this email is regarding your concern about the unknown charges ll be more than happy to assist you with your inquiry and will do my absolute best to help the charges you received are likely to be related to company service or subscription you have signed up for judging by the price this is likely company cloud subscription if you would like to cancel your subscription please follow the guideline below from your company phone settings account center payment and purchases subscriptions and tap the service you wish to cancel the subscription for from your computer access the official website login to https id cloud company com cas portal login html and go to payment and purchases subscriptions password free payments and touch remove please be aware that if you access the online portal with your phone you should first activate the desktop version of the browser if the subscription disappears from your account it indicates that it has been canceled successfully once canceled no deduction will be made from your account from the following month onward if you need further assistance please provide us the following information to investigate your account and provide more information around the subscription your company id phone number include country code email address your request g cancel company cloud subscription cancel company music subscription cancel company video subscription proof of transactions if the payment was made with your bank card copy of your bank statement showing the charges from se and the last digits of your bank card if the payment was made with your paypal screenshot of payment with transaction invoice number available if the payment was made with your phone the phone number get charged screenshot of phone bill showing the charges from se if you have any further questions please feel free to reply to this email thread and we will be happy to walk you through your doubts we would greatly appreciate your feedback regarding our email exchange as we need your input to keep improving our service therefore we invite you to fill in the survey that will soon arrive on the email address you used to contact us sincerely ramon se is the provider of company mobile services to company and honor device owners in to unknown payment could you please tell me what this payment is for,In-App Purchase / Cancel /terminate subscription,In-App Purchase ,Suggestion,Payment,Subscription cancellation
22991,64506,44805.78889,support.eu@Company.com,unknown payment,just wanted to make sure it wasn a scam don remember signing up for this but if it for more storage then it very possible did kind regards lord wrote we hope you re doing well this email is regarding your concern about the unknown charges ll be more than happy to assist you with your inquiry and will do my absolute best to help the charges you received are likely to be related to company service or subscription you have signed up for judging by the price this is likely company cloud subscription if you would like to cancel your subscription please follow the guideline below from your company phone settings account center payment and purchases subscriptions and tap the service you wish to cancel the subscription for from your computer access the official website login to https id cloud company com cas portal login html and go to payment and purchases subscriptions password free payments and touch remove please be aware that if you access the online portal with your phone you should first activate the desktop version of the browser if the subscription disappears from your account it indicates that it has been canceled successfully once canceled no deduction will be made from your account from the following month onward if you need further assistance please provide us the following information to investigate your account and provide more information around the subscription your company id phone number include country code email address your request g cancel company cloud subscription cancel company music subscription cancel company video subscription proof of transactions if the payment was made with your bank card copy of your bank statement showing the charges from se and the last digits of your bank card if the payment was made with your paypal screenshot of payment with transaction invoice number available if the payment was made with your phone the phone number get charged screenshot of phone bill showing the charges from se if you have any further questions please feel free to reply to this email thread and we will be happy to walk you through your doubts we would greatly appreciate your feedback regarding our email exchange as we need your input to keep improving our service therefore we invite you to fill in the survey that will soon arrive on the email address you used to contact us sincerely ramon se is the provider of company mobile services to company and honor device owners in to unknown payment could you please tell me what this payment is for,In-App Purchase / Cancel /terminate subscription,In-App Purchase ,Suggestion,Payment,Subscription cancellation
22991,64511,44805.79306,support.eu@Company.com,,for clarifying your request if there is anything else that we can assist you with please feel free to contact us again sincerely madalin se is the provider of company mobile services to company and honor device owners in to unknown payment just wanted to make sure it wasn a scam don remember signing up for this but if it for more storage then it very possible did kind regards lord on thu wrote we hope you re doing well this email is regarding your concern about the unknown charges ll be more than happy to assist you with your inquiry and will do my absolute best to help the charges you received are likely to be related to company service or subscription you have signed up for judging by the price this is likely company cloud subscription if you would like to cancel your subscription please follow the guideline below from your company phone settings account center payment and purchases subscriptions and tap the service you wish to cancel the subscription for from your computer access the official website login to https id cloud company com cas portal login html and go to payment and purchases subscriptions password free payments and touch remove please be aware that if you access the online portal with your phone you should first activate the desktop version of the browser if the subscription disappears from your account it indicates that it has been canceled successfully once canceled no deduction will be made from your account from the following month onward if you need further assistance please provide us the following information to investigate your account and provide more information around the subscription your company id phone number include country code email address your request g cancel company cloud subscription cancel company music subscription cancel company video subscription proof of transactions if the payment was made with your bank card copy of your bank statement showing the charges from se and the last digits of your bank card if the payment was made with your paypal screenshot of payment with transaction invoice number available if the payment was made with your phone the phone number get charged screenshot of phone bill showing the charges from se if you have any further questions please feel free to reply to this email thread and we will be happy to walk you through your doubts we would greatly appreciate your feedback regarding our email exchange as we need your input to keep improving our service therefore we invite you to fill in the survey that will soon arrive on the email address you used to contact us sincerely ramon se is the provider of company mobile services to company and honor device owners in to unknown payment could you please tell me what this payment is for,In-App Purchase / Cancel /terminate subscription,In-App Purchase ,Suggestion,Payment,Subscription cancellation
22990,64301,44805.50694,support.eu@Company.com,withdrawal,ladies and gentlemen would like to terminate as soon as possible transaction numbe x last invoice numbe f i ask for confirmation,In-App Purchase / Cancel /terminate subscription,In-App Purchase ,Suggestion,Payment,Subscription cancellation
