Ticket id,Interaction id,Interaction date,Mailbox,x_ts,x_ic,Innso TYPOLOGY_TICKET ,y1,y2,y3,y4
23019,64436,44805.66319,support.eu@Company.com,cancel,thanks for email in dont know what this money m paying for is anyway ve know idea what password is have alzheimer and my family tell me to leave my phone alone so hopefully it cancelled through paypal ll soon know when get email to say payment has not gone out ll deal with it then thanks pugh hillrise avenue ryde isle of wight po tt get outlook for android from sent pm to subject cancel we hope you re doing well this email is regarding your concern about cancelling your subscription payment ll be more than happy to assist you with your inquiry if you are being charged monthly amount from your bank account it means that you have an active subscription now or you have accessed the free trial of some application in the past after which once the trial period has passed you have started to be charged monthly fee we do not have the necessary permission to cancel subscriptions on behalf of our users but will gladly walk you through the process on how to cancel it go to https id cloud company com cas portal login html log in account center payment and purchases subscriptions password free payments and click remove if you will access our online portal through your phone browser please enable first the desktop site so you will be able to see the payment and purchases window if for any reason you need further assistance with your inquiry please send us the following information you company id phone number include country code email address proof of transactions if the payment was made with your bank card copy of your bank statement showing the charges from se and the last digits of your bank card if the payment was made with your paypal screenshot of payment with transaction invoice number available id starting with c if the payment was made with your phone the phone number get charged screenshot of phone bill showing the charges from se we hope this information is useful and it solves your issue for further questions please feel free to reply to this email thread and we will be happy to walk you through your doubts also we would greatly appreciate your feedback regarding our email exchange as we need your input to keep improving our service therefore we invite you to fill in the survey that will soon arrive on the email address you used to contact us sincerely cristiana se is the provider of company mobile services to company and honor device owners in to thought was doing quiz then realised it was going to take monthly money which ve just cancelled thankyou mrs pugh hillrise avenue ryde isle of wight po tt don know what this payment is for so can you cancel it for me thanks sue pugh hillrise avenue ryde isle of wight po tt get outlook for android,In-App Purchase / Cancel /terminate subscription,In-App Purchase ,Suggestion,Payment,Subscription cancellation
23019,64437,44805.66875,support.eu@Company.com,,thank for reaching us back and clarifying the situation understand this situation might be difficult for you and how it has caused inconvenience for your situation but rest assured we will do our best to find fitted solution for your problem to proceed further would you please forward us the following details if the payment was made with your paypal screenshot of payment with transaction invoice number available id starting with after that we will contact our internal team and get back to you as soon as possible for further questions please feel free to reply to this email thread and we will be happy to walk you through your doubts sincerely cristiana se is the provider of company mobile services to company and honor device owners in to cancel thanks for email in dont know what this money m paying for is anyway ve know idea what password is have alzheimer and my family tell me to leave my phone alone so hopefully it cancelled through paypal ll soon know when get email to say payment has not gone out ll deal with it then thanks pugh hillrise avenue ryde isle of wight po tt get outlook for android from sent pm to subject cancel we hope you re doing well this email is regarding your concern about cancelling your subscription payment ll be more than happy to assist you with your inquiry if you are being charged monthly amount from your bank account it means that you have an active subscription now or you have accessed the free trial of some application in the past after which once the trial period has passed you have started to be charged monthly fee we do not have the necessary permission to cancel subscriptions on behalf of our users but will gladly walk you through the process on how to cancel it go to https id cloud company com cas portal login html log in account center payment and purchases subscriptions password free payments and click remove if you will access our online portal through your phone browser please enable first the desktop site so you will be able to see the payment and purchases window if for any reason you need further assistance with your inquiry please send us the following information you company id phone number include country code email address proof of transactions if the payment was made with your bank card copy of your bank statement showing the charges from se and the last digits of your bank card if the payment was made with your paypal screenshot of payment with transaction invoice number available id starting with c if the payment was made with your phone the phone number get charged screenshot of phone bill showing the charges from se we hope this information is useful and it solves your issue for further questions please feel free to reply to this email thread and we will be happy to walk you through your doubts also we would greatly appreciate your feedback regarding our email exchange as we need your input to keep improving our service therefore we invite you to fill in the survey that will soon arrive on the email address you used to contact us sincerely cristiana se is the provider of company mobile services to company and honor device owners in to thought was doing quiz then realised it was going to take monthly money which ve just cancelled thankyou mrs pugh hillrise avenue ryde isle of wight po tt don know what this payment is for so can you cancel it for me thanks sue pugh hillrise avenue ryde isle of wight po tt get outlook for android,In-App Purchase / Cancel /terminate subscription,In-App Purchase ,Suggestion,Payment,Subscription cancellation
23016,64413,44805.63194,support.de@Company.com,required account,if you do not have the right to do so you will have the right to do so if you do not have the right to do so you will have the right to do so if you do not have the right to do so you will have the right to do so if you do not have the right to do so you will have the right to do so if you do not have the right to do so you will have the right to do so if you do not have the right to do so you will have the right to do so if you do not have the right to do so you will have the right to do so,In-App Purchase / Invoice request,In-App Purchase ,Suggestion,Invoice,Invoice related request
23016,64419,44805.63958,support.de@Company.com,required account,if you are member of the company you are member of the company if you are member of the company you are member of the company if you are member of the company you are member of the company if you are member of the company you are member of the company if you are member of the company you are member of the company if you are member of the company you are member of the company if you are member of the company you are member of the company if you are member of the company you are member of the company if you are member of the company you are member of the company if you are member of the company you are member of the company if you are member of the company you are member of the company if you are member of the company you are,In-App Purchase / Invoice request,In-App Purchase ,Suggestion,Invoice,Invoice related request
23016,64435,44805.66389,support.de@Company.com,required account,if you do not have the right to do so you will have the right to do so if you do not have the right to do so you will have the right to do so if you do not have the right to do so you will have the right to do so if you do not have the right to do so you will have the right to do so if you do not have the right to do so you will have the right to do so if you do not have the right to do so you will have the right to do so if you do not have the right to do so you will have the right to do so if you do not have the right to do so you will have the right to do so if you do not have the right to do so you will have the right to do so,In-App Purchase / Invoice request,In-App Purchase ,Suggestion,Invoice,Invoice related request
23011,64369,44805.60833,support.eu@Company.com,issue,want to terminate the subscription with the invoicing id y us,In-App Purchase / Cancel /terminate subscription,In-App Purchase ,Suggestion,Payment,Subscription cancellation
23011,64394,44805.62083,support.eu@Company.com,,would be more than happy to assist you with your inquiry based on our understanding your issue related to canceling subscription unfortunately we do not have the necessary permission to cancel subscriptions on behalf of our users due to privacy concerns will provide you with the cancellation steps but if you run into any issues while following them you will also find below what information we require from you to be able to investigate from your computer access the official website login to https id cloud company com cas portal login html and go to payment and purchases subscriptions password free payments and touch remove please note that if you access the website from your phone you must enable desktop version for the payment and purchases tab to show up if the subscription disappears from your account it indicates that it has been canceled successfully once canceled no deduction will be made from your account from the following month onward if you need further assistance please provide us the following information to investigate your account and provide more information around the subscription your company id phone number include country code email address proof of transactions if the payment was made with your bank card copy of your bank statement showing the charges from se and the last digits of your bank card if the payment was made with your paypal screenshot of payment with transaction invoice number available if the payment was made with your phone the phone number get charged screenshot of phone bill showing the charges from se if you have any further questions please feel free to reply to this email thread and we will be happy to walk you through your doubts for your understanding sincerely alexandra se is the provider of company mobile services to company and honor device owners in to jag vill avsluta abonnemanget med fakturerings id y us,In-App Purchase / Cancel /terminate subscription,In-App Purchase ,Suggestion,Payment,Subscription cancellation
23008,64362,44805.60694,support.eu@Company.com,,den tis skrev please note that we were able to identify company id associated to this email address you are writing us from therefore please try to log in the online webportal to cancel your subscription using as your company id if you access the online portal with your phone you should first activate the desktop version of the browser to be able to see the payments purchases tab on the account and security page if after logging in there is no subscriptions shown on the payments page please provide us the following information to investigate your account and provide more information around the subscription proof of transactions if the payment was made with your bank card copy of your bank statement showing the charges from se and the last digits of your bank card if the payment was made with your paypal screenshot of payment with transaction invoice number available id starting with c if the payment was made with your phone the phone number get charged screenshot of phone bill showing the charges from se if you have any further questions please feel free to reply to this email thread and we will be happy to walk you through your doubts sincerely cristiana se is the provider of company mobile services to company and honor device owners in to so if dont have my account cant cancel it den tis skrev we do not have the necessary permission to cancel subscriptions on behalf of our users but will gladly walk you through the process on how to cancel it from any type of device or browser login to https id cloud company com cas portal login html and go to payment and purchases subscriptions password free payments and touch remove please be aware that if you access the online portal with your phone you should first activate the desktop version of the browser if the subscription disappears from your account it indicates that it has been canceled successfully once canceled no deduction will be made from your account from the following month onward we would greatly appreciate your feedback regarding our email exchange as we need your input to keep improving our service therefore we invite you to fill in the survey that will soon arrive on the email address you used to contact us if you have any further questions please feel free to reply to this email thread and we will be happy to walk you through your doubts sincerely cristiana se is the provider of company mobile services to company and honor device owners in to ok want to cancel this one because have samsung now instead den tis skrev would be more than happy to assist you with your inquiry but please take in consideration that we can offer you support in the following languages english portuguese spanish italian french german if you would like to cancel your subscription please follow the guideline below from any type of device or browser login to https id cloud company com cas portal login html and go to payment and purchases subscriptions password free payments and touch remove please be aware that if you access the online portal with your phone you should first activate the desktop version of the browser if the subscription disappears from your account it indicates that it has been canceled successfully once canceled no deduction will be made from your account from the following month onward if for any reason you need further assistance please provide us the following information to investigate your account and provide more information around the subscription your company id phone number include country code email address proof of transactions if the payment was made with your bank card copy of your bank statement showing the charges from se and the last digits of your bank card if the payment was made with your paypal screenshot of payment with transaction invoice number available id starting with c if the payment was made with your phone the phone number get charged screenshot of phone bill showing the charges from se if you have any further questions please feel free to reply to this email thread and we will be happy to walk you through your doubts we would greatly appreciate your feedback regarding our email exchange as we need your input to keep improving our service therefore we invite you to fill in the survey that will soon arrive on the email address you used to contact us sincerely cristiana se is the provider of company mobile services to company and honor device owners in to hej jag har inte kvar min telefon och vill rmed ga upp mitt abonnemang hos er mvh katarina,In-App Purchase / Cancel /terminate subscription,In-App Purchase ,Suggestion,Payment,Subscription cancellation
23008,64381,44805.61458,support.eu@Company.com,dismissal,will forward the details to our internal team to see if they can find out under which account this subscription is active so that you cancel it however for our team to be able to identify the account connected to the transaction we need the invoice number id starting with if the payment was made by paypal if your payment was made by bank card we need the last digits of your bank card associated to that specific subscription transaction sincerely cristiana se is the provider of company mobile services to company and honor device owners in to den tis skrev please note that we were able to identify company id associated to this email address you are writing us from therefore please try to log in the online webportal to cancel your subscription using as your company id if you access the online portal with your phone you should first activate the desktop version of the browser to be able to see the payments purchases tab on the account and security page if after logging in there is no subscriptions shown on the payments page please provide us the following information to investigate your account and provide more information around the subscription proof of transactions if the payment was made with your bank card copy of your bank statement showing the charges from se and the last digits of your bank card if the payment was made with your paypal screenshot of payment with transaction invoice number available id starting with c if the payment was made with your phone the phone number get charged screenshot of phone bill showing the charges from se if you have any further questions please feel free to reply to this email thread and we will be happy to walk you through your doubts sincerely cristiana se is the provider of company mobile services to company and honor device owners in to so if dont have my account cant cancel it den tis skrev we do not have the necessary permission to cancel subscriptions on behalf of our users but will gladly walk you through the process on how to cancel it from any type of device or browser login to https id cloud company com cas portal login html and go to payment and purchases subscriptions password free payments and touch remove please be aware that if you access the online portal with your phone you should first activate the desktop version of the browser if the subscription disappears from your account it indicates that it has been canceled successfully once canceled no deduction will be made from your account from the following month onward we would greatly appreciate your feedback regarding our email exchange as we need your input to keep improving our service therefore we invite you to fill in the survey that will soon arrive on the email address you used to contact us if you have any further questions please feel free to reply to this email thread and we will be happy to walk you through your doubts sincerely cristiana se is the provider of company mobile services to company and honor device owners in to ok want to cancel this one because have samsung now instead den tis skrev would be more than happy to assist you with your inquiry but please take in consideration that we can offer you support in the following languages english portuguese spanish italian french german if you would like to cancel your subscription please follow the guideline below from any type of device or browser login to https id cloud company com cas portal login html and go to payment and purchases subscriptions password free payments and touch remove please be aware that if you access the online portal with your phone you should first activate the desktop version of the browser if the subscription disappears from your account it indicates that it has been canceled successfully once canceled no deduction will be made from your account from the following month onward if for any reason you need further assistance please provide us the following information to investigate your account and provide more information around the subscription your company id phone number include country code email address proof of transactions if the payment was made with your bank card copy of your bank statement showing the charges from se and the last digits of your bank card if the payment was made with your paypal screenshot of payment with transaction invoice number available id starting with c if the payment was made with your phone the phone number get charged screenshot of phone bill showing the charges from se if you have any further questions please feel free to reply to this email thread and we will be happy to walk you through your doubts we would greatly appreciate your feedback regarding our email exchange as we need your input to keep improving our service therefore we invite you to fill in the survey that will soon arrive on the email address you used to contact us sincerely cristiana se is the provider of company mobile services to company and honor device owners in to hej jag har inte kvar min telefon och vill rmed ga upp mitt abonnemang hos er mvh katarina,In-App Purchase / Cancel /terminate subscription,In-App Purchase ,Suggestion,Payment,Subscription cancellation
